{
  "$schema": "https://json-schema.org/draft/2020-12/schema",
  "$id": "https://aip.org/schemas/ledger-record.json",
  "title": "LedgerRecord",
  "description": "Final ledger record summarizing reserved amount, actual billing, and revshare settlement.",
  "type": "object",
  "required": [
    "serve_token",
    "session_id",
    "auction_id",
    "platform_id",
    "brand_agent_id",
    "state",
    "reserved_unit",
    "reserved_amount_micros",
    "final_unit",
    "final_amount_micros",
    "currency",
    "timestamps"
  ],
  "properties": {
    "serve_token": {
      "type": "string",
      "description": "Unique token linking exposure → click → conversion",
      "example": "stk_abcxyz123"
    },
    "session_id": {
      "type": "string",
      "description": "Session identifier",
      "example": "sess_001"
    },
    "auction_id": {
      "type": "string",
      "description": "Auction identifier",
      "example": "auc_981"
    },
    "platform_id": {
      "type": "string",
      "description": "Platform identifier",
      "example": "pf_chatgpt"
    },
    "brand_agent_id": {
      "type": "string",
      "description": "Brand agent responsible for the bid",
      "example": "ba_451"
    },
    "state": {
      "type": "string",
      "enum": ["PENDING", "EXPOSED", "CLICKED", "CONVERTED", "FINALIZED", "REFUNDED"],
      "description": "Final state of the ad lifecycle",
      "example": "FINALIZED"
    },
    "reserved_unit": {
      "type": "string",
      "enum": ["CPX", "CPC", "CPE", "CPA"],
      "description": "Pricing unit reserved at auction time",
      "example": "CPA"
    },
    "reserved_amount_micros": {
      "type": "integer",
      "minimum": 0,
      "description": "Maximum amount held from advertiser wallet (in USD micros, int64)",
      "example": 5000000
    },
    "final_unit": {
      "type": "string",
      "enum": ["CPX", "CPC", "CPE", "CPA"],
      "description": "Final pricing unit applied after events",
      "example": "CPC"
    },
    "final_amount_micros": {
      "type": "integer",
      "minimum": 0,
      "description": "Actual charge applied to advertiser wallet (in USD micros, int64)",
      "example": 1200000
    },
    "currency": {
      "type": "string",
      "pattern": "^[A-Z]{3}$",
      "description": "Currency code",
      "example": "USD"
    },
    "timestamps": {
      "type": "object",
      "description": "Event timestamps",
      "properties": {
        "auction": { "type": "string", "format": "date-time" },
        "exposure_shown": { "type": "string", "format": "date-time" },
        "interaction_started": { "type": "string", "format": "date-time" },
        "delegation_started": { "type": "string", "format": "date-time" },
        "delegation_activity_last_seen": { "type": "string", "format": "date-time" },
        "delegation_expired": { "type": "string", "format": "date-time" },
        "task_completed": { "type": "string", "format": "date-time" },
        "finalized": { "type": "string", "format": "date-time" }
      },
      "example": {
        "auction": "2025-11-11T18:00:00Z",
        "exposure_shown": "2025-11-11T18:00:01Z",
        "interaction_started": "2025-11-11T18:02:00Z",
        "delegation_activity_last_seen": "2025-11-11T18:18:00Z",
        "task_completed": "2025-11-11T18:30:00Z",
        "finalized": "2025-11-11T19:00:00Z"
      }
    },
    "revenue_share": {
      "type": "object",
      "description": "Revenue distribution breakdown",
      "properties": {
        "platform_micros": { "type": "integer", "minimum": 0 },
        "operator_micros": { "type": "integer", "minimum": 0 }
      },
      "example": {
        "platform_micros": 300000,
        "operator_micros": 900000
      }
    },
    "ext": {
      "$ref": "./common.json#/definitions/extensionNamespace"
    }
  }
}
